{
  "schema_version": "2.0",
  "dataset_id": "aihd-retrieval-holdout-v2",
  "generation": {
    "namespace": "AIHD_PHASE1_V2_HOLDOUT_2026-08-18",
    "implementation_commit": "573cc1c0b16364db4a65e59221aa8f74c3b259a7",
    "spec_sha256": "6e5a054fef65db1777d8b6582e86b56763bda2b4c9719b3936ab3139bafde82d",
    "seed_sha256": "113934ff03946cec75b58070abb0da0f187943b7d34a52e21701c46659e4fa49"
  },
  "cases": [
    {
      "case_id": "RET-V2-B-001",
      "split": "HOLDOUT",
      "query": "怎样用 新会话测试 判断 Codex 不是碰巧遵守了 这份 AGENTS.md？",
      "expected_status": "CANDIDATE",
      "expected_candidates": [
        "FIX-CODEX-AGENTS"
      ],
      "risk_class": "LOW",
      "precondition": "ELIGIBLE",
      "provenance": {
        "kind": "synthetic_fixture",
        "source_ref": "holdout-spec.v2.json#candidate_agents",
        "privacy": "public_safe"
      },
      "rationale": "验证项目 AGENTS 指令是否被读取和触发。",
      "tags": [
        "candidate",
        "generated",
        "natural-paraphrase"
      ]
    },
    {
      "case_id": "RET-V2-B-002",
      "split": "HOLDOUT",
      "query": "怎样用 应触发／不应触发对照 判断 这个项目里的 Codex 不是碰巧遵守了 项目 AGENTS.md？",
      "expected_status": "CANDIDATE",
      "expected_candidates": [
        "FIX-CODEX-AGENTS"
      ],
      "risk_class": "LOW",
      "precondition": "ELIGIBLE",
      "provenance": {
        "kind": "synthetic_fixture",
        "source_ref": "holdout-spec.v2.json#candidate_agents",
        "privacy": "public_safe"
      },
      "rationale": "验证项目 AGENTS 指令是否被读取和触发。",
      "tags": [
        "candidate",
        "generated",
        "natural-paraphrase"
      ]
    },
    {
      "case_id": "RET-V2-B-003",
      "split": "HOLDOUT",
      "query": "新开的 Codex 运行 可能没有读到 这份 AGENTS.md，如何用无副作用探针验证？",
      "expected_status": "CANDIDATE",
      "expected_candidates": [
        "FIX-CODEX-AGENTS"
      ],
      "risk_class": "LOW",
      "precondition": "ELIGIBLE",
      "provenance": {
        "kind": "synthetic_fixture",
        "source_ref": "holdout-spec.v2.json#candidate_agents",
        "privacy": "public_safe"
      },
      "rationale": "验证项目 AGENTS 指令是否被读取和触发。",
      "tags": [
        "candidate",
        "generated",
        "natural-paraphrase"
      ]
    },
    {
      "case_id": "RET-V2-B-004",
      "split": "HOLDOUT",
      "query": "从 仓库根目录 启动后，继承哪份规则？",
      "expected_status": "CANDIDATE",
      "expected_candidates": [
        "FIX-CODEX-INSTRUCTION-SCOPE"
      ],
      "risk_class": "LOW",
      "precondition": "ELIGIBLE",
      "provenance": {
        "kind": "synthetic_fixture",
        "source_ref": "holdout-spec.v2.json#candidate_scope",
        "privacy": "public_safe"
      },
      "rationale": "判断全局、项目和子目录指令的作用域与覆盖。",
      "tags": [
        "candidate",
        "generated",
        "scope"
      ]
    },
    {
      "case_id": "RET-V2-B-005",
      "split": "HOLDOUT",
      "query": "从 某个子目录 启动后，适用哪条指令链？",
      "expected_status": "CANDIDATE",
      "expected_candidates": [
        "FIX-CODEX-INSTRUCTION-SCOPE"
      ],
      "risk_class": "LOW",
      "precondition": "ELIGIBLE",
      "provenance": {
        "kind": "synthetic_fixture",
        "source_ref": "holdout-spec.v2.json#candidate_scope",
        "privacy": "public_safe"
      },
      "rationale": "判断全局、项目和子目录指令的作用域与覆盖。",
      "tags": [
        "candidate",
        "generated",
        "scope"
      ]
    },
    {
      "case_id": "RET-V2-B-006",
      "split": "HOLDOUT",
      "query": "上层与近目录规则冲突，Codex 应该采用哪一层说明？",
      "expected_status": "CANDIDATE",
      "expected_candidates": [
        "FIX-CODEX-INSTRUCTION-SCOPE"
      ],
      "risk_class": "LOW",
      "precondition": "ELIGIBLE",
      "provenance": {
        "kind": "synthetic_fixture",
        "source_ref": "holdout-spec.v2.json#candidate_scope",
        "privacy": "public_safe"
      },
      "rationale": "判断全局、项目和子目录指令的作用域与覆盖。",
      "tags": [
        "candidate",
        "generated",
        "scope"
      ]
    },
    {
      "case_id": "RET-V2-B-007",
      "split": "HOLDOUT",
      "query": "sandbox restriction 一直出现，怎么区分审批策略和文件权限？",
      "expected_status": "CANDIDATE",
      "expected_candidates": [
        "FIX-CODEX-SANDBOX"
      ],
      "risk_class": "MEDIUM",
      "precondition": "ELIGIBLE",
      "provenance": {
        "kind": "synthetic_fixture",
        "source_ref": "holdout-spec.v2.json#candidate_sandbox",
        "privacy": "public_safe"
      },
      "rationale": "诊断文件、命令或网络被沙箱和审批策略阻断。",
      "tags": [
        "bilingual",
        "candidate",
        "generated",
        "sandbox"
      ]
    },
    {
      "case_id": "RET-V2-B-008",
      "split": "HOLDOUT",
      "query": "Codex 能读到规则，但 还是不能写文件，下一步该查什么？",
      "expected_status": "CANDIDATE",
      "expected_candidates": [
        "FIX-CODEX-SANDBOX"
      ],
      "risk_class": "MEDIUM",
      "precondition": "ELIGIBLE",
      "provenance": {
        "kind": "synthetic_fixture",
        "source_ref": "holdout-spec.v2.json#candidate_sandbox",
        "privacy": "public_safe"
      },
      "rationale": "诊断文件、命令或网络被沙箱和审批策略阻断。",
      "tags": [
        "bilingual",
        "candidate",
        "generated",
        "sandbox"
      ]
    },
    {
      "case_id": "RET-V2-B-009",
      "split": "HOLDOUT",
      "query": "Codex 能读到规则，但 命令仍执行不了，这类权限问题怎么定位？",
      "expected_status": "CANDIDATE",
      "expected_candidates": [
        "FIX-CODEX-SANDBOX"
      ],
      "risk_class": "MEDIUM",
      "precondition": "ELIGIBLE",
      "provenance": {
        "kind": "synthetic_fixture",
        "source_ref": "holdout-spec.v2.json#candidate_sandbox",
        "privacy": "public_safe"
      },
      "rationale": "诊断文件、命令或网络被沙箱和审批策略阻断。",
      "tags": [
        "bilingual",
        "candidate",
        "generated",
        "sandbox"
      ]
    },
    {
      "case_id": "RET-V2-B-010",
      "split": "HOLDOUT",
      "query": "配置检查通过，可工具仍不可用，下一步查哪一层？",
      "expected_status": "CANDIDATE",
      "expected_candidates": [
        "FIX-CODEX-MCP"
      ],
      "risk_class": "MEDIUM",
      "precondition": "ELIGIBLE",
      "provenance": {
        "kind": "synthetic_fixture",
        "source_ref": "holdout-spec.v2.json#candidate_mcp",
        "privacy": "public_safe"
      },
      "rationale": "验证 MCP 配置、连接和当前运行工具投影。",
      "tags": [
        "candidate",
        "generated",
        "mcp"
      ]
    },
    {
      "case_id": "RET-V2-B-011",
      "split": "HOLDOUT",
      "query": "怎样证明 这个 server 已连接并投影到 当前 session？",
      "expected_status": "CANDIDATE",
      "expected_candidates": [
        "FIX-CODEX-MCP"
      ],
      "risk_class": "MEDIUM",
      "precondition": "ELIGIBLE",
      "provenance": {
        "kind": "synthetic_fixture",
        "source_ref": "holdout-spec.v2.json#candidate_mcp",
        "privacy": "public_safe"
      },
      "rationale": "验证 MCP 配置、连接和当前运行工具投影。",
      "tags": [
        "candidate",
        "generated",
        "mcp"
      ]
    },
    {
      "case_id": "RET-V2-B-012",
      "split": "HOLDOUT",
      "query": "doctor 显示健康，可工具仍不可用，下一步查哪一层？",
      "expected_status": "CANDIDATE",
      "expected_candidates": [
        "FIX-CODEX-MCP"
      ],
      "risk_class": "MEDIUM",
      "precondition": "ELIGIBLE",
      "provenance": {
        "kind": "synthetic_fixture",
        "source_ref": "holdout-spec.v2.json#candidate_mcp",
        "privacy": "public_safe"
      },
      "rationale": "验证 MCP 配置、连接和当前运行工具投影。",
      "tags": [
        "candidate",
        "generated",
        "mcp"
      ]
    },
    {
      "case_id": "RET-V2-B-013",
      "split": "HOLDOUT",
      "query": "这个 Agent 重启后不记得任务，是 项目 memory 没被读取 还是只丢了会话上下文？",
      "expected_status": "CANDIDATE",
      "expected_candidates": [
        "FIX-OPENCLAW-MEMORY"
      ],
      "risk_class": "MEDIUM",
      "precondition": "ELIGIBLE",
      "provenance": {
        "kind": "synthetic_fixture",
        "source_ref": "holdout-spec.v2.json#candidate_memory",
        "privacy": "public_safe"
      },
      "rationale": "区分 OpenClaw 项目长期记忆和当前会话上下文。",
      "tags": [
        "candidate",
        "generated",
        "memory"
      ]
    },
    {
      "case_id": "RET-V2-B-014",
      "split": "HOLDOUT",
      "query": "重启后的 session 没带上已有项目事实，该查写入还是读回？",
      "expected_status": "CANDIDATE",
      "expected_candidates": [
        "FIX-OPENCLAW-MEMORY"
      ],
      "risk_class": "MEDIUM",
      "precondition": "ELIGIBLE",
      "provenance": {
        "kind": "synthetic_fixture",
        "source_ref": "holdout-spec.v2.json#candidate_memory",
        "privacy": "public_safe"
      },
      "rationale": "区分 OpenClaw 项目长期记忆和当前会话上下文。",
      "tags": [
        "candidate",
        "generated",
        "memory"
      ]
    },
    {
      "case_id": "RET-V2-B-015",
      "split": "HOLDOUT",
      "query": "小龙虾 开新对话就丢了状态，是 没有写进长期记忆 还是只丢了会话上下文？",
      "expected_status": "CANDIDATE",
      "expected_candidates": [
        "FIX-OPENCLAW-MEMORY"
      ],
      "risk_class": "MEDIUM",
      "precondition": "ELIGIBLE",
      "provenance": {
        "kind": "synthetic_fixture",
        "source_ref": "holdout-spec.v2.json#candidate_memory",
        "privacy": "public_safe"
      },
      "rationale": "区分 OpenClaw 项目长期记忆和当前会话上下文。",
      "tags": [
        "candidate",
        "generated",
        "memory"
      ]
    },
    {
      "case_id": "RET-V2-B-016",
      "split": "HOLDOUT",
      "query": "AGENTS.md 不生效，是 根本没加载，还是 被子目录覆盖了？",
      "expected_status": "CLARIFY",
      "expected_candidates": [
        "FIX-CODEX-AGENTS",
        "FIX-CODEX-INSTRUCTION-SCOPE"
      ],
      "risk_class": "MEDIUM",
      "precondition": "ELIGIBLE",
      "provenance": {
        "kind": "synthetic_fixture",
        "source_ref": "holdout-spec.v2.json#clarify_agents_scope",
        "privacy": "public_safe"
      },
      "rationale": "规则加载验证与指令作用域都可能改变下一步。",
      "tags": [
        "ambiguity",
        "clarify",
        "generated"
      ]
    },
    {
      "case_id": "RET-V2-B-017",
      "split": "HOLDOUT",